"ANSWER__C","ARCHIVEDBYID","ARCHIVEDDATE","ARTICLEARCHIVEDBYID","ARTICLEARCHIVEDDATE","ARTICLECASEATTACHCOUNT","ARTICLECREATEDBYID","ARTICLECREATEDDATE","ARTICLEMASTERLANGUAGE","ARTICLENUMBER","ARTICLETOTALVIEWCOUNT","ASSIGNEDBYID","ASSIGNEDTOID","ASSIGNMENTDATE","ASSIGNMENTDUEDATE","ASSIGNMENTNOTE","CREATEDBYID","CREATEDDATE","FIRSTPUBLISHEDDATE","ID","ISDELETED","ISLATESTVERSION","ISVISIBLEINAPP","ISVISIBLEINCSP","ISVISIBLEINPKB","ISVISIBLEINPRM","KNOWLEDGEARTICLEID","LANGUAGE","LASTMODIFIEDBYID","LASTMODIFIEDDATE","LASTPUBLISHEDDATE","MIGRATEDTOFROMARTICLEVERSION","OWNERID","PUBLISHSTATUS","QUESTION__C","RECORDTYPEID","SOURCEID","SUMMARY","SYSTEMMODSTAMP","TITLE","URLNAME","VALIDATIONSTATUS","VERSIONNUMBER"
"Our drivers are instructed to leave packages in out of the way places. Try checking in more hidden locations near the front or back door. If you are still unable to find your package reach out to our service team and we will help you resolve your case.","","","","","0","0054x0000019PZsAAM","2020-12-10T21:33:24.000Z","en_US","000001004","1","","","","","","0054x0000019PZsAAM","2020-12-10T21:33:24.000Z","2020-12-10T21:38:18.000Z","ka04x000000q3BAAAY","false","true","true","false","false","false","kA04x000000lmAACAY","en_US","0054x0000019PZsAAM","2020-12-10T21:38:18.000Z","2020-12-10T21:38:18.000Z","","0054x0000019PZsAAM","Online","My package&#39;s shows it&#39;s delivered but I can&#39;t find it. What should I do?","0124x000000tA4rAAE","","","2020-12-11T00:09:07.000Z","My package's shows it's delivered but I can't find it. What should I do?","My-package-s-shows-it-s-delivered-but-I-can-t-find-it-What-should-I-do","Not Validated","1"
"Our drivers are instructed to leave packages in out of the way places. Try checking in more hidden locations near the front or back door. If you are still unable to find your package reach out to our service team and we will help you resolve your case.","","","","","0","0054x0000019PZsAAM","2020-12-10T21:33:24.000Z","en_US","000001004","1","0054x0000019PZsAAM","0054x0000019PZsAAM","2020-12-10T23:47:26.000Z","","","0054x0000019PZsAAM","2020-12-10T23:47:26.000Z","2020-12-10T21:38:18.000Z","ka04x000000q3mZAAQ","false","true","true","true","true","true","kA04x000000lmAACAY","en_US","0054x0000019PZsAAM","2020-12-10T23:47:40.000Z","2020-12-10T21:38:18.000Z","","0054x0000019PZsAAM","Draft","My package&#39;s shows it&#39;s delivered but I can&#39;t find it. What should I do?","0124x000000tA4rAAE","","","2020-12-10T23:47:40.000Z","My package's shows it's delivered but I can't find it. What should I do?","My-package-s-shows-it-s-delivered-but-I-can-t-find-it-What-should-I-do","Not Validated","0"
"Shipping costs depend on a large variety of factors including but not limited to size, weight, and distance shipped.","","","","","0","0054x0000019PZsAAM","2020-12-10T17:42:26.000Z","en_US","000001001","2","","","","","","0054x0000019PZsAAM","2020-12-10T17:43:08.000Z","2020-12-10T17:43:00.000Z","ka04x000000q2E0AAI","false","true","true","true","true","true","kA04x000000llD9CAI","en_US","0054x0000019PZsAAM","2020-12-10T21:38:04.000Z","2020-12-10T21:38:04.000Z","","0054x0000019PZsAAM","Online","How much will shipping my package cost?","0124x000000tA4rAAE","","","2020-12-11T00:09:07.000Z","How much will shipping cost?","How-much-will-shipping-cost","Not Validated","2"
"If your package is labeled missing by one of our drivers and included insurance your claim will automatically be submitted. You should receive a confirmation email about the status of your claim in 7-10 business days.","","","","","0","0054x0000019PZsAAM","2020-12-10T17:49:05.000Z","en_US","000001002","3","","","","","","0054x0000019PZsAAM","2020-12-10T17:49:05.000Z","2020-12-10T21:37:44.000Z","ka04x000000q2E5AAI","false","true","true","true","true","true","kA04x000000llDACAY","en_US","0054x0000019PZsAAM","2020-12-10T21:37:44.000Z","2020-12-10T21:37:44.000Z","","0054x0000019PZsAAM","Online","How do I submit an insurance claim?","0124x000000tA4rAAE","","","2020-12-11T00:09:07.000Z","How do I submit a claim?","How-do-I-submit-a-claim","Not Validated","1"
"Log on to our customer portal and click the tab that says mail list. You can then sort your view by delivery status","","","","","0","0054x0000019PZsAAM","2020-12-10T17:56:34.000Z","en_US","000001003","1","","","","","","0054x0000019PZsAAM","2020-12-10T17:56:34.000Z","2020-12-10T17:56:46.000Z","ka04x000000q2E6AAI","false","true","true","true","true","true","kA04x000000llDBCAY","en_US","0054x0000019PZsAAM","2020-12-10T17:56:46.000Z","2020-12-10T17:56:46.000Z","","0054x0000019PZsAAM","Online","How do I find the delivery status of my package?","0124x000000tA4rAAE","","","2020-12-11T00:09:07.000Z","How do I find out the status of my package","How-do-I-find-out-the-status-of-my-package","Not Validated","1"
"You will log into our customer portal and select the Package tracking tab and enter your tracking number then click the track button.<br><a href=""https://goingpostalp1v2-developer-edition.na150.force.com"" target=""_blank"">https://goingpostalp1v2-developer-edition.na150.force.com</a>","","","","","0","0054x0000019PZsAAM","2020-12-10T17:38:20.000Z","en_US","000001000","0","","","","","","0054x0000019PZsAAM","2020-12-10T17:39:20.000Z","2020-12-10T17:38:52.000Z","ka04x000000q2DzAAI","false","true","true","true","true","true","kA04x000000llD4CAI","en_US","0054x0000019PZsAAM","2020-12-10T17:39:49.000Z","2020-12-10T17:39:49.000Z","","0054x0000019PZsAAM","Online","How do I track my package?","0124x000000tA4rAAE","","","2020-12-11T00:09:07.000Z","How to track your package.","How-to-track-your-package","Not Validated","2"
